{"controlSha":"0123456789abcdef0123456789abcdef01234567","databaseRestoreRequired":true,"errorCode":null,"evidence":{"backupId":"backup-v1.2.3-20260731","databaseRestore":"RESTORED","targetStateSha256":"sha256:aaaaaaaaaaaaaaaaaaaaaaaaaaaaaaaaaaaaaaaaaaaaaaaaaaaaaaaaaaaaaaaa"},"kind":"rollback-workflow-outcome","operationId":"rbk_0123456789abcdef0123456789abcdef","rollbackState":"SUCCEEDED","schemaVersion":1,"sourceRelease":"v1.2.4","targetRelease":"v1.2.3","transportStatus":"CONFIRMED","workflowRunAttempt":1,"workflowRunId":123456789}
